,titulo,fecha,texto,periodico
28,Banano colombiano presente en Expo Dubai,2021-04-21,"El banano colombiano viene abriendo mercados internacionales a pasos agigantados, tanto es así que la Asociación de Bananeros de Colombia (Augura), confirmó su participación en Expo Dubái, un evento de promoción internacional considerado el más importante del mundo y que por primera vez se realizará en Medio Oriente, donde se tiene la esperanza que esta actividad contribuya a la reactivación de la economía mundial. Cabe resaltar, que el año pasado las delicias del banano colombiano fue adquirido por países como Argelia, Túnez, Emiratos Árabes Unidos, Marruecos y Qatar, estas naciones fueron los mayores compradores de este producto nacional que ha marcado la diferencia. De acuerdo a las cifras reveladas por el DANE, las exportaciones a esos mercados sumaron USD$4,6 millones, más del 100% de lo registrado en 2019. “Expo Dubái será una vitrina de oportunidades para Colombia, donde ofreceremos banano con valor agregado. La participación en este evento nos permitirá impulsar aún más el campo colombiano y dar a conocer nuestro compromiso con la generación de empleo formal, los procesos técnicos, ambientales y sociales mediante los cuales se produce fruta de alta calidad”, aseguró Emerson Aguirre Medina, presidente de Augura. Por su parte, Flavia Toro, presidente de ProColombia, se mostró satisfecha ante la participación del país en este tipo de eventos y dijo, “en Expo Dubái podremos mostrar la oferta turística colombiana, posicionar al país como destino de inversión y exhibir la excelente calidad de nuestros productos agrícolas para exportación. La vinculación del gremio bananero a esta exposición es una muestra del compromiso con la reactivación económica para seguir contribuyendo con el desarrollo de Colombia”. Según datos entregados por Augura, Dubai importa el 85% de lo que consume, además su ubicación geográfica y cercanía con África favorece a los exportadores colombianos. , “Dubai es un comprador natural de banano, es un mercado de nicho que ofrece un excelente escenario para presentar un producto de alta calidad, que ocupa el tercer renglón de exportación del país”. La agroindustria del banano en Colombia genera 35.000 empleos directos y 100 mil  indirectos, es decir que 150 mil familias dependen de esta actividad agrícola. Finalmente, el Gremio resaltó que el trabajador bananero es el mejor remunerado del agro colombiano, motivo de orgullo que refleja el interés en ellos y sus familias.",El Heraldo
29,Lo que dice el Grupo Sura frente a la compra de vacunas por privados,2021-04-21,"El Grupo Sura, uno de los conglomerados económicos más importantes del país, envió una carta al Consejo Gremial Nacional en la que plasma una serie de recomendaciones sobre la iniciativa del sector privado para participar en la compra de vacunas. En la misiva, el grupo económico señaló que “es importante que prevalezca el liderazgo de las autoridades sanitarias del país y que cualquier esfuerzo adicional o complementario desde las empresas atienda las orientaciones y la priorización epidemiológica establecida por el Plan Nacional de Vacunación”. El segundo punto que destacaron fue que el compromiso que deben tener los privados de “asegurar que el interés de llegar a otros segmentos poblacionales o etarios, paralelamente al Plan Nacional de Vacunación, no compita con los esfuerzos públicos”. El conglomerado señaló que “desde una perspectiva ética”, precisaron que las acciones de vacunación paralelas “eviten reproducir potenciales inequidades derivadas de las mayores posibilidades de acceso a vacunas que tienen algunas empresas o industrias, frente a otras en condiciones de menor capacidad”. Finalmente, señalaron que como organización, el rol del sector privado está asociado con la logística en torno a la disponibilidad de las vacunas, fortalecer las redes de distribución, habilitar espacios y modalidades adicionales para ampliar la inoculación, especialmente, en aquellas ciudades y territorios que más lo necesiten, en articulación con las autoridades nacionales y locales. El Grupo Sura se mostró en la disposición de seguir participando con “soluciones a esta coyuntura” de atención a los colombianos y a la implementación del Plan Nacional de Vacunación. Asimismo, el conglomerado espera seguir dialogando con el Gobierno Nacional en pro de “definir la mejor forma en que podemos seguir participando y contribuyendo a este proceso como parte del sector privado”.",El Heraldo
30,Fenalco propone celebrar el Día de la madre durante todo mayo,2021-04-21,"La Federación Nacional de Comerciantes, Fenalco, siendo conscientes de la situación de pandemia que vive el país y las medidas restrictivas que se vienen adoptando, hizo un llamado al Gobierno nacional, al comercio formal y a la ciudadanía para que la tradicional fiesta del Día de la Madre programada para el próximo 9 de mayo no solo se celebre ese día sino durante todo el mes de mayo. “De esta manera, el comercio organizado, el sector de la gastronomía y el turismo tendrán la oportunidad de ofrecer sus productos y servicios en los días en los que no haya restricciones y en consecuencia no perder nuevamente esta temporada”, aseguró, Jaime Alberto Cabal, presidente de Fenalco. El vocero de los comerciantes por medio de un documento hizo la petición al ministro de Comercio José Manuel Restrepo, y le manifestó que el día de la madre es la segunda celebración más importante en Colombia después de Navidad y por lo tanto, “es importante trabajar en conjunto para que se puedan evitar aglomeraciones y concentraciones en un sólo día ampliando y permitiendo que las familias colombianas decidan en qué día del mes de mayo le rendirán homenaje a las madres”, recalcó. Fenalco entregó cifras con respecto a las estadísticas que dejan las celebraciones en años anteriores de ese día e indicó, “históricamente el 97% de los colombianos celebra el Día de las Madres y en promedio gasta entre 100.000 y 200.000 pesos en obsequios, que mayoritariamente son ropa, calzado, accesorios, invitaciones a restaurantes, viajes y bonos de regalo”. Al final, Fenalco dejó claro su compromiso con la Nación e instó a acudir a la unión para contrarrestar los efectos de la pandemia, no obstante son conscientes del momento difícil que vive el comercio formal.  ",El Heraldo
31,SIC inicia investigación contra Ticket Fast,2021-04-21,"De confirmarse la vulneración a los derechos de los consumidores presuntamente afectados podrían ser sancionados con más de $2 mil millones La Superintendencia de Industria y Comercio, anunció que inició investigación administrativa en contra de la sociedad TICKET FAST S.A.S., por presuntamente haber efectuado el cobro de boletería cuya compra no se concretó en su sistema, así mismo,  por generar duplicidad de cobros originados en compras motivadas por mensajes de rechazo enviados a los consumidores, e impedir el ingreso a consumidores a un evento cuya boletería fue adquirida en el establecimiento de comercio de la investigada. Según el ente de control que protege al consumidor, pudo establecer de manera preliminar que, al parecer, a través de la página web www.tuboleta.com no se informó a los consumidores en forma clara, oportuna, suficiente, comprensible, precisa e idónea el procedimiento para hacer efectivos los descuentos o promociones para determinados eventos, como habría sucedido con el evento “Disney On Ice” llevado a cabo en el año 2019, circunstancias que configuran una posible vulneración a los artículos 33 y 23 de la Ley 1480 de 2011 y al numeral 2.1.2.1. del Título Segundo de la Circular Única de la Superintendencia. Otras denuncias De otro lado, la SIC recibió nuevas denuncias que tienen que ver con el servicio “Asegura Tu boleta” ofertado durante el proceso de adquisición de boletería de espectáculos públicos que se realiza por medio de la página web www.tuboleta.com, pues al parecer, la casilla relacionada a dicho servicio, que se encuentra preseleccionada por el sistema de la sociedad para su adquisición por parte de los consumidores, podría no ser fácilmente identificable y comprensible por estos, debido a que se trata de un servicio opcional e independiente de la venta de boletería, lo que configuraría una vulneración al numeral 1.3 del artículo 3 y al artículo 23 de la Ley 1480 de 2011. La entidad reguladora del Estado anunció también que, “revisará la presunta omisión de TICKET FAST S.A.S., respecto del deber de informar a esta Entidad la cancelación o modificación de eventos cuya boletería se comercializó a través de su página web”. En virtud a lo anterior, indicó que, “de conformidad con lo señalado por la Ley 1480 de 2011, se debe garantizar la información y calidad de los servicios que se prestan en el mercado y después de conocer que algunos consumidores presentaron inconvenientes con la prestación de los servicios de emisión, venta y suministro de boletería de espectáculos públicos realizados o a realizarse entre el año 2019 e inicio de 2020”. Entre estos eventos mencionó a “Disney on Ice”, “The Illusionist”, “Viva la Salsa”, “André Rieu”, “Colombia es ópera”, “Norah Jones”, “Superconcierto del Carnaval de Barranquilla – Arco iris Tour de J Balvin”. Finalmente, la SIC manifestó que revisará las actuaciones desplegadas por la sociedad investigada para establecer si cumplió o no con las obligaciones contenidas en el Estatuto del Consumidor y sus normas concordantes. Y recalcó que Contra el acto administrativo de formulación de cargos no procede ningún recurso.  ",El Heraldo
32,Dólar se hace fuerte y gana $9,2021-04-21,"La Bolsa de Valores  de Colombia reporta que en su jornada de apertura el dólar abrió en $3.641,60, su precio promedio se cotiza en $3.650,10. La divisa norteamericana viene presentando niveles más altos en comparación con los días anteriores. La Tasa Representativa del Mercado (TRM) reconoce una variación de 0,12% al cotizarse en $3.636. El barril de petróleo Brent se muestra con tendencia a la baja en las primeras horas de este mércoles 21 de abril, pierde USD$0,79  y se negocia en USD$62,61.",El Heraldo
33,Porvenir presenta resultados en sostenibilidad con lineamientos GRI,2021-04-21,"Con el objetivo de fomentar la transparencia y continuar fortaleciendo la confianza con sus grupos de interés, el fondo de pensiones y cesantías Porvenir alineado a las prácticas de reporte del Grupo Aval, publica su primer informe de sostenibilidad, siguiendo la metodología GRI Esencial, lo cual le permite comunicar sus principales avances en materia de gestión ambiental, social y económica evidenciando el aporte de la compañía a la sociedad. El Global Reporting Initiative (GRI) es una organización cuyo fin es impulsar la elaboración de memorias de sostenibilidad en todo tipo de organizaciones, para el fondo Porvenir presentar su informe de gestión sostenible bajo estos lineamientos se convierte en el mejor ejercicio de rendición de cuentas para evidenciar la transparencia y los valores corporativos de la compañía. De este modo, tanto afiliados, empleadores, pensionados, comunidades, proveedores, la opinión pública y la sociedad en general pueden consultar en este informe, de libre acceso en su página web,  el detalle de las acciones, resultados y retos planteados en temas como oferta de valor, inversión responsable, educación financiera, desarrollo de comunidades, gestión del talento entre otras, que permiten entender la manera en que el fondo de pensiones y cesantías Porvenir integra las expectativas de sus grupos de interés en su gestión de sostenibilidad y  comunica sus avances en esta materia de una forma transparente y abierta con sus partes interesadas. Recientemente el fondo se adhirió al Consejo Empresarial Colombiano para el Desarrollo Sostenible (CECODES), el capítulo en Colombia del World Business Council for Sustainable Development (WBCSD), organización global que reúne empresas de diferentes sectores que trabajan bajo estándares de sostenibilidad y que tienen la firme convicción de que éste es el camino para lograr una mayor rentabilidad, aportar al bienestar de las personas y darles un uso adecuado a los recursos. De acuerdo con Bernardo Sánchez, gerente de mercadeo en el fondo de pensiones y cesantías Porvenir, “con la adhesión a CECODES, nos convertimos en la primera administradora de pensiones en colombia en ingresar a este consejo, contribuyendo a la consolidación de un sistema de protección a la vejez equitativo, solidario y sostenible para así avanzar en nuestro compromiso con la sostenibilidad, como la mejor forma de aportar al bienestar financiero de sus 12.7 millones de afiliados, sus familias y de todo el país”. La AFP continúa robusteciendo su modelo de sostenibilidad adoptando mejores prácticas en cuatro dimensiones: gestión ambiental, desarrollo social, desempeño económico y gobierno corporativo. Gestión ambiental: Porvenir desarrolla acciones para tener una operación cada vez más responsable con el planeta, a través del uso adecuado de los recursos
naturales. Es así como, entre otras acciones, lanzó la primera alternativa 100% ASG en Pensiones Voluntarias: ""Generación Sostenible Porvenir"" como parte del portafolio de productos verdes y sembró 10.000 árboles en zonas deforestadas en diferentes lugares del país. Desarrollo social: La ampliación del alcance de la ""Academia del Ahorro"", programa sombrilla de educación financiera de Porvenir, con iniciativas puntales para colaboradores, proveedores y comunidades en zonas rurales de Colombia. Porvenir, además, robusteció los canales digitales logrando que más del 97% de las transacciones se realizaran por estos medios. Gobierno corporativo y riesgo: Adelantó acciones que permite a los colombianos integrarse en la toma de decisiones de negocio aspectos no
financieros, bajo estándares de transparencia e integridad. A su vez, gestionó el 100% de las denuncias reportadas a través de la línea ética y actualizó los conocimientos de los colaboradores en materia de gestión de riesgos y anticorrupción. Desempeño económico: La AFP trabaja diariamente para fomentar el crecimiento sostenible y la generación de valor compartido. Durante el 2020, Porvenir ratificó su liderazgo en el mercado colombiano y cerró el año con 12,7 millones de aliados y un crecimiento en activos bajo administración del 8% respecto del 2019, llegando a $175,1 billones.",El Heraldo
34,Ingreso Solidario y Devolución del IVA serían permanentes con la tributaria,2021-04-21,"El Gobierno nacional ampliará y elevará el monto de la ayuda monetaria a través de los programas sociales de Ingreso Solidario y Devolución del IVA, según el Departamento Nacional de Planeación, como una estrategia dirigida a garantizar la seguridad alimentaria a cerca del 50 % de los colombianos, que se encuentran en condición de pobreza y vulnerabilidad. Con la propuesta de solidaridad y transformación social planteada en el Proyecto de Ley de Solidaridad Sostenible el Gobierno nacional propone iniciativas que buscarían aliviar la situación económica de quienes más lo necesitan en el país. “El 50% por ciento de los hogares colombianos aumentará sus ingresos con esta Ley de Solidaridad Sostenible”, aseguró el director del Departamento Nacional de Planeación (DNP), Luis Alberto Rodríguez.  Entre las novedades que trae la iniciativa se encuentra aumentar el monto que reciben los hogares beneficiarios de la Devolución de IVA, que pasaría de $75.000 a $100.000 cada dos meses.  La Devolución del IVA, creada por el presidente Iván Duque busca llegar desde este mes de abril a 2 millones de hogares, pero de aprobarse la reforma alcanzaría los 4,7 millones de hogares, es decir, más de 12 millones de colombianos beneficiados.  En el caso del Programa Ingreso Solidario entregaría entre $80.000 y $360.000, según el número de personas en el hogar, la ubicación de su familia entre zona rural y urbana; y pasaría a ser un programa permanente. “Sería una política de Estado y no un programa de gobierno”, explicó Rodríguez.  Los hogares beneficiarios de Ingreso Solidario, conformados por una sola persona, recibirían $80.000. En un hogar en pobreza extrema y pobreza de dos integrantes, la ayuda será de $122.034 y $84.047, respectivamente. Para el hogar con tres integrantes en pobreza extrema y pobreza, recibirían $183.050 y $126.071, en ese orden. En caso de que el hogar en extrema pobreza o en pobreza lo conformen cuatro personas la ayuda será de $244.067 y $168.095, para cada uno de esos hogares. Cuando los hogares son de cinco personas tanto en pobreza extrema y pobreza, recibirían $305.084 y $210.118. Finalmente, a las familias en extrema pobreza y pobreza con seis integrantes, se les entregaría $366.101 y $252.142.  Ingreso Solidario y Devolución de IVA son programas complementarios a Familias en Acción, Jóvenes en Acción y Colombia Mayor, a los que el Estado les entrega subsidios porque se encuentran por debajo de la línea de pobreza.  “Con programas como el PAEF se evitó que cerca de 4 millones de empleados perdieran sus trabajos, este programa se diseñó para atender a los trabajadores hasta finales de 2020 y lo extendimos hasta marzo de 2021. Ahora planteamos que se extienda hasta junio de este año”, dijo el director del DNP",El Heraldo
35,Críticas de Uribe a la reforma tributaria por su impacto en la industria del cine colombiano,2021-04-21,"
""La reforma (tributaria) es para enfrentar la pobreza no para retroceder lo avanzado en promoción del cine nacional y la cultura"", afirmó el exsenador Álvaro Uribe Vélez quien cuestionó al equipo económico del Gobierno por solicitar el retiro de los beneficios que tiene la industria en la propuesta presentada al Congreso.Dice además que afectará la economía naranja y que es contraria a los esfuerzos que ha liderado el presidente Iván Duque en lo corrido de su gobierno.""El presidente Duque creó toda la sensibilidad a la economía naranja, creatividad, cultura. Por favor, que su equipo económico no quite los estímulos cuando apenas empiezan y han tenido el tropiezo de la pandemia"", señaló.El exmandatario se refiere a que según el texto presentado por el Ministerio de Hacienda la reforma tributaria contempla eliminar la cuota para el desarrollo cinematográfico, una contribución parafiscal administrada por el Fondo para el Desarrollo Cinematográfico. La función de este fondo es estimular la producción cinematográfica en Colombia, y de ser aprobada la propuesta, eliminarían esta contribución por lo que la realización en el país pasaría a depender del Presupuesto General de la Nación.El gremio cinematográfico, a través de un pronunciamiento en la plataforma www.change.org también han señalado que esta iniciativa representa una amenaza para el desarrollo del sector en Colombia. ""La reforma propone eliminar artículos cruciales de la Ley 814 de 2003, más conocida como Ley de Cine. Los artículos derogados son los que crean y reglamentan la Cuota para el Desarrollo Cinematográfico y el que le otorga al Fondo para el Desarrollo Cinematográfico FDC sus recursos"", detallaron.
Lea además: Dramaturgo Diego Montoya le pide a Ospina diálogo con artistas en Cali, hace contundente llamado
",El pais
36,Cambio Radical dice que tampoco apoyará la reforma tributaria en el Congreso,2021-04-21,"
El partido Cambio Radical anunció que no apoyará la reforma tributaria durante su votación en el Congreso, que se dará luego de que el Gobierno Nacional presentará la propuesta. La bancada argumentó que la consideran ""inoportuna y contraria"" a lo que requiere el país para seguir avanzando con la reactivación de la economía por la pandemia.La decisión se tomó en reunión y por unanimidad tras la que señalaron que la colectividad ""no acompañará al Gobierno (...) por considerarla totalmente inoportuna y en contravía del objetivo de recuperación de la economía y el empleo que requiere alcanzar el país"".Y agrega el documento divulgado que también ""carece de unidad de materia, requisito constitucional indispensable para el trámite de cualquier ley. Esta decisión tiene los efectos vinculantes de la Ley"".
Lea además: Reforma tributaria: los puntos claves de la propuesta que tiene debatiendo al país
La bancada rechaza 15 puntos de la propuesta, entre ellos los incrementos superiores al 300 % en la tributación de los asalariados con ingresos mensuales entre $2.5 millones y $7.5 millones, así como los aumentos propuestos al impuesto de renta para personas naturales.Se apartan también del gravamen sobre las pensiones, el impuesto solidario del 10 % para los salarios e ingresos de personas naturales, del desmonte de las deducciones para el ahorro privado, las cesantías los intereses de vivienda, las pensiones y las cuentas de Ahorro para el Fomento de la Construcción (AFC) y las deducciones para la construcción de Vivienda de Interés Social (VIS).Rechazan el traslado de los alimentos y los medicamentos de la categoría de exentos a la categoría de excluidos de IVA, que implica incrementar su precio y un beneficio para la industria extranjera en detrimento de la industria nacional; el IVA sobre los servicios públicos; el IVA a la tecnología, al internet domiciliario del estrato 3, como también a los celulares y computadores de baja gama.Indican también que no comparten el incremento en la tarifa de las sociedades, las facultades extraordinarias en materia de retención en la fuente, gravar los espectáculos deportivos, servicios culturales y de diversión. También impuestos sobre los artículos de uso íntimo femenino como toallas sanitarias, tampones y protectores; la creación de más burocracia a través de la reforma tributaria y las facultades extras para reformar el Estado.La posición coincide con la postura de Germán Vargas Lleras, jefe del partido y excandidato a la Presidencia, que en el último mes ha manifestado que la iniciativa en este momento es ""una equivocación"" y consideró el proyecto ""una colcha de retazos"".Aunque Cambio Radical es un partido independiente viene participando en el gobierno, por lo que se esperaba que apoyara la reforma, pero con su negativa será más difícil que el proyecto logre una mayoría amplia.
Lea además: Reforma tributaria: los puntos claves de la propuesta que tiene debatiendo al país
",El pais
